{
  "id": "banach_tarski",
  "category": "paradoxes",
  "release_number": 29,
  "release_date": "2026-05-10",
  "tags": [
    "mathematics",
    "infinity",
    "axiom_of_choice"
  ],
  "difficulty": 5,
  "reading_time_sec": 195,
  "theme_override": null,
  "illustration_ref": "bundle://illustrations/banach_tarski.svg",
  "i18n": {
    "ru": {
      "blocks": [
        {
          "type": "category_label",
          "props": {
            "text": "Парадокс · №5"
          }
        },
        {
          "type": "hook",
          "props": {
            "text": "В 1924 году Банах и Тарский доказали: любой шар можно разрезать на конечное число кусков и собрать из них {{em:два таких же шара}}. Не уменьшенных копий — настоящих, точно такого же размера…"
          }
        },
        {
          "type": "title",
          "props": {
            "text": "Парадокс {{accent:Банаха-Тарского}}"
          }
        },
        {
          "type": "subtitle",
          "props": {
            "text": "Banach-Tarski Paradox · S. Banach & A. Tarski · 1924"
          }
        },
        {
          "type": "illustration",
          "props": {
            "ref": "bundle://illustrations/banach_tarski.svg",
            "alt": "Один шар разбирается на конечное число частей и собирается в два шара того же размера"
          }
        },
        {
          "type": "body_paragraphs",
          "props": {
            "drop_cap": true,
            "paragraphs": [
              "Это математически доказанная теорема, не загадка. Шар разрезается на 5 кусков, кусочки переставляются (вращения и переносы) — получаются два полных шара того же радиуса. Объём вырос вдвое из ничего. Закон сохранения {{em:не нарушен}} — потому что он применяется к измеримым множествам, а кусочки в этом разрезе {{em:не измеримы}}.",
              "Ключ — аксиома выбора. Это утверждение математики что из бесконечного количества множеств можно «выбрать» по одному элементу из каждого. Звучит безобидно. Но порождает такие странности как Банах-Тарский.",
              "Этот парадокс — не проблема. Это {{em:доказательство}} что наша интуиция о бесконечности не совпадает с математикой. Объём в физическом мире не растёт — потому что физический мир конечен и измерим. Парадокс живёт только в чистой математике."
            ]
          }
        },
        {
          "type": "riddle_reveal",
          "props": {
            "tag": "Парадокс",
            "question": "Если математически шар можно удвоить — почему я не могу удвоить апельсин дома?",
            "hint": "Что отличает математический шар от физического апельсина?",
            "user_prompt": "Думаю — открыть разгадку",
            "reveal_text": "Математический шар состоит из несчётной бесконечности точек, разрезается на множества которые не имеют объёма (не измеримы). Физический апельсин состоит из конечного числа атомов. Атомы нельзя «разрезать на множества с дробным числом атомов». Парадокс работает только в идеализированном мире, где материя бесконечно делима. Наш мир дискретен.",
            "formula": "B = A₁ ∪ A₂ ∪ A₃ ∪ A₄ ∪ A₅\nA₁ ∪ A₂ ⟶ B (через вращение)\nA₃ ∪ A₄ ∪ A₅ ⟶ B (через вращение)",
            "intuition_trap": "Интуиция считает что объём — фундаментальное свойство. Но в чистой математике объём — измерительная операция, и она не определена для всех множеств. {{em:Не все вещи имеют объём в строгом смысле}}."
          }
        },
        {
          "type": "trap",
          "props": {
            "label": "Глубже",
            "text": "Парадокс заставил математиков задуматься: правильна ли аксиома выбора? Это всё ещё спорный вопрос. Большинство математики XX века построено с её принятием. Без неё многие теоремы рушатся. С ней — рождается Банах-Тарский."
          }
        },
        {
          "type": "domains",
          "props": {
            "heading": "Зачем это знать",
            "items": [
              {
                "label": "Об интуиции",
                "example": "Парадокс показывает что физическая интуиция не работает в бесконечности. Это важно когда думаешь о космосе, квантовом мире, теории чисел."
              },
              {
                "label": "О математике",
                "example": "Понимание что не всё в математике «реально» в физическом смысле — освобождает от наивного реализма. Математика — это инструмент, не описание."
              },
              {
                "label": "Об аксиомах",
                "example": "Любая дисциплина начинается с аксиом. Изменишь аксиомы — получишь другую систему. Геометрия Евклида и Лобачевского — обе верны, на разных аксиомах."
              }
            ]
          }
        },
        {
          "type": "action_today",
          "props": {
            "label": "Действие на сегодня",
            "text": "Возьмите одно «очевидное» убеждение о мире (что-то «нельзя удвоить из ничего», «время идёт вперёд», и т.п.). Подумайте: на каких аксиомах оно основано? Что если аксиомы другие?"
          }
        }
      ]
    },
    "en": {
      "blocks": [
        {
          "type": "category_label",
          "props": {
            "text": "Paradox · №5"
          }
        },
        {
          "type": "hook",
          "props": {
            "text": "In 1924 Banach and Tarski proved: any ball can be cut into a finite number of pieces and reassembled into {{em:two identical balls}}. Not smaller copies — full ones, the same radius…"
          }
        },
        {
          "type": "title",
          "props": {
            "text": "{{accent:Banach-Tarski}} Paradox"
          }
        },
        {
          "type": "subtitle",
          "props": {
            "text": "Banach-Tarski Paradox · S. Banach & A. Tarski · 1924"
          }
        },
        {
          "type": "illustration",
          "props": {
            "ref": "bundle://illustrations/banach_tarski.svg",
            "alt": "One ball decomposed into a finite number of pieces, reassembled into two identical balls"
          }
        },
        {
          "type": "body_paragraphs",
          "props": {
            "drop_cap": true,
            "paragraphs": [
              "This is a proven theorem, not a riddle. The ball gets cut into 5 pieces, the pieces are rotated and translated — and you get two full balls of the same radius. Volume doubled from nothing. The conservation law {{em:isn't violated}} — it applies to measurable sets, and the pieces in this cut {{em:aren't measurable}}.",
              "The key is the Axiom of Choice — the math claim that from infinitely many sets you can «pick» one element from each. Sounds innocent. Produces oddities like Banach-Tarski.",
              "This paradox isn't a problem — it's {{em:proof}} that our intuition about infinity doesn't match math. Volume in the physical world doesn't grow — because the physical world is finite and measurable. The paradox lives only in pure math."
            ]
          }
        },
        {
          "type": "riddle_reveal",
          "props": {
            "tag": "Paradox",
            "question": "If you can mathematically double a ball — why can't I double an orange at home?",
            "hint": "What separates a mathematical ball from a physical orange?",
            "user_prompt": "Show me the answer",
            "reveal_text": "A mathematical ball is an uncountable infinity of points, cut into sets that have no volume (non-measurable). A physical orange consists of a finite number of atoms. You can't «cut atoms into sets with a fractional number of atoms». The paradox only works in an idealized world where matter is infinitely divisible. Our world is discrete.",
            "formula": "B = A₁ ∪ A₂ ∪ A₃ ∪ A₄ ∪ A₅\nA₁ ∪ A₂ ⟶ B (via rotation)\nA₃ ∪ A₄ ∪ A₅ ⟶ B (via rotation)",
            "intuition_trap": "Intuition treats volume as fundamental. In pure math, volume is a measurement operation — and it isn't defined for all sets. {{em:Not all things have volume in the strict sense}}."
          }
        },
        {
          "type": "trap",
          "props": {
            "label": "Deeper",
            "text": "The paradox made mathematicians ask: is the Axiom of Choice correct? Still debated. Most of 20th-century math is built assuming it. Without it many theorems collapse. With it — Banach-Tarski is born."
          }
        },
        {
          "type": "domains",
          "props": {
            "heading": "Why care",
            "items": [
              {
                "label": "About intuition",
                "example": "The paradox shows physical intuition doesn't survive infinity. Important when thinking about space, quantum, number theory."
              },
              {
                "label": "About math",
                "example": "Realizing not everything in math is «real» physically — frees you from naive realism. Math is a tool, not a description."
              },
              {
                "label": "About axioms",
                "example": "Every discipline starts with axioms. Change the axioms — different system. Euclidean and Lobachevskian geometries are both correct on different axioms."
              }
            ]
          }
        },
        {
          "type": "action_today",
          "props": {
            "label": "Action for today",
            "text": "Take one «obvious» belief about the world (something can't be doubled from nothing, time goes forward, etc.). Ask: which axioms is it built on? What if the axioms were different?"
          }
        }
      ]
    }
  },
  "levels": [
    {
      "level": 1,
      "doc_ref": "models/banach_tarski"
    }
  ]
}
